{
  "schema": "mission-grant/v1",
  "grant_id": "grant-1234567890abcdef1234",
  "workspace_id": "wkspc-abc123def456",
  "capability": "email.send.external",
  "target": "person@example.com",
  "input_hash": "sha256:aaaaaaaaaaaaaaaaaaaaaaaaaaaaaaaaaaaaaaaaaaaaaaaaaaaaaaaaaaaaaaaa",
  "lifetime": "single_action",
  "max_executions": 1,
  "execution_count": 0,
  "created_at": "2026-07-11T20:00:00.000Z",
  "expires_at": "2026-07-11T20:10:00.000Z",
  "revocable": true,
  "revoked_at": "",
  "source": "authenticated_mission_mobile"
}
